{
  "@context": "https://linked.art/ns/v1/linked-art.json",
  "id": "https://linked.art/example/provenance/16",
  "type": "Activity",
  "_label": "Lending a Sculpture to Recipient",
  "classified_as": [
    {
      "id": "http://vocab.getty.edu/aat/300055863",
      "type": "Type",
      "_label": "Provenance Activity"
    }
  ],
  "part": [
    {
      "type": "TransferOfCustody",
      "classified_as": [
        {
          "id": "http://vocab.getty.edu/aat/300417645",
          "type": "Type",
          "_label": "Loan"
        }
      ],
      "transferred_custody_of": [
        {
          "type": "HumanMadeObject",
          "_label": "Sculpture",
          "classified_as": [
            {
              "id": "http://vocab.getty.edu/aat/300047090",
              "type": "Type",
              "_label": "Sculpture",
              "classified_as": [
                {
                  "id": "http://vocab.getty.edu/aat/300435443",
                  "type": "Type",
                  "_label": "Type of Work"
                }
              ]
            },
            {
              "id": "http://vocab.getty.edu/aat/300133025",
              "type": "Type",
              "_label": "Artwork"
            }
          ]
        }
      ],
      "transferred_custody_from": [
        {
          "type": "Person",
          "_label": "Lender"
        }
      ],
      "transferred_custody_to": [
        {
          "type": "Person",
          "_label": "Recipient"
        }
      ]
    }
  ]
}