{
  "@context": "https://linked.art/ns/v1/linked-art.json",
  "id": "https://linked.art/example/provenance/19",
  "type": "Activity",
  "_label": "Loss of Painting",
  "classified_as": [
    {
      "id": "http://vocab.getty.edu/aat/300055863",
      "type": "Type",
      "_label": "Provenance Activity"
    }
  ],
  "part": [
    {
      "type": "TransferOfCustody",
      "classified_as": [
        {
          "id": "http://vocab.getty.edu/aat/300417655",
          "type": "Type",
          "_label": "Loss"
        }
      ],
      "timespan": {
        "type": "TimeSpan",
        "_label": "Time noticed as Lost",
        "begin_of_the_begin": "1790-12-04T00:00:00Z",
        "end_of_the_end": "1790-12-05T00:00:00Z"
      },
      "transferred_custody_of": [
        {
          "type": "HumanMadeObject",
          "_label": "Lost Painting",
          "classified_as": [
            {
              "id": "http://vocab.getty.edu/aat/300033618",
              "type": "Type",
              "_label": "Painting",
              "classified_as": [
                {
                  "id": "http://vocab.getty.edu/aat/300435443",
                  "type": "Type",
                  "_label": "Type of Work"
                }
              ]
            },
            {
              "id": "http://vocab.getty.edu/aat/300133025",
              "type": "Type",
              "_label": "Artwork"
            }
          ]
        }
      ],
      "transferred_custody_from": [
        {
          "type": "Person",
          "_label": "Owner"
        }
      ]
    }
  ]
}